{
  "schema_version": "jobagent-user-state/v2",
  "project_key": "jobagent:personal:v2",
  "updated_at": "2026-09-18T09:00:00.000Z",
  "jobs": {
    "job:alpha": {
      "favorite": true,
      "favorite_updated_at": "2026-09-18T09:00:00.000Z",
      "application_stage": "PREPARING",
      "application_updated_at": "2026-09-18T09:00:00.000Z",
      "applied": false,
      "applied_at": null,
      "note": "Synthetische Notiz.",
      "next_action": "Unterlagen pruefen",
      "tasks": [],
      "application_history": []
    }
  }
}
